{"type":"config","name":"Optimize scanner throughput across representative repos","metricName":"total_ms","metricUnit":"ms","bestDirection":"lower"}
{"run":1,"commit":"0479266","metric":15205.371,"metrics":{},"status":"keep","description":"Baseline: scanner throughput harness over agent-ci, umami, astro, and openclaw with test+build checks","timestamp":1775663387545,"segment":0}
{"run":2,"commit":"0479266","metric":15566.403,"metrics":{},"status":"discard","description":"Precompile ignore regexes and switch discovery language lookup to a simple loop","timestamp":1775663501218,"segment":0}
{"run":3,"commit":"fd45621","metric":10330.611,"metrics":{},"status":"keep","description":"Avoid a second TypeScript source file parse for logical LOC and count physical lines without text.split allocations","timestamp":1775663584137,"segment":0}
{"run":4,"commit":"fd45621","metric":0,"metrics":{},"status":"crash","description":"Disable AST parent links and pass variable names explicitly for anonymous function names","timestamp":1775663737671,"segment":0}
{"run":5,"commit":"fd45621","metric":0,"metrics":{},"status":"crash","description":"Disable AST parent links with explicit arrow-function names and path-based logging detection","timestamp":1775663789830,"segment":0}
{"run":6,"commit":"5338fac","metric":9692.326,"metrics":{},"status":"keep","description":"Replace nested statement rescans in test mock setup extraction with a single-pass active-statement traversal","timestamp":1775663879632,"segment":0}
{"run":7,"commit":"5338fac","metric":0,"metrics":{},"status":"crash","description":"Skip hasAwait scans for non-async functions and skip duplicate fingerprints for test files","timestamp":1775663988721,"segment":0}
{"run":8,"commit":"0a4debb","metric":9074.674,"metrics":{},"status":"keep","description":"Skip hasAwait scans for non-async functions and avoid duplicate-signature fingerprints for test files","timestamp":1775664051373,"segment":0}
{"run":9,"commit":"0a4debb","metric":0,"metrics":{},"status":"crash","description":"Remove parent-link helper dependencies so TypeScript ASTs can be created without parent pointers","timestamp":1775664215720,"segment":0}
{"run":10,"commit":"0a4debb","metric":9108.876,"metrics":{},"status":"discard","description":"Combine duplicate-fingerprint node counting and local-name collection into one traversal","timestamp":1775664289234,"segment":0}
{"run":11,"commit":"0a4debb","metric":9695.707,"metrics":{},"status":"discard","description":"Replace per-try subtree rescans with a single traversal that accumulates boundary categories for active try blocks","timestamp":1775664450776,"segment":0}
{"run":12,"commit":"0a4debb","metric":0,"metrics":{},"status":"crash","description":"Disable TypeScript AST parent pointers after removing direct parent and getText helper dependencies","timestamp":1775664559134,"segment":0}
{"run":13,"commit":"0a4debb","metric":9368.005,"metrics":{},"status":"discard","description":"Skip test mock AST walks for test files whose text lacks any mock-related substrings","timestamp":1775664729537,"segment":0}
{"run":14,"commit":"0a4debb","metric":9243.059,"metrics":{},"status":"discard","description":"Match mock-related call paths from path segments before joining the full expression path string","timestamp":1775664829563,"segment":0}
{"run":15,"commit":"0a4debb","metric":9469.502,"metrics":{},"status":"discard","description":"Short-circuit await detection with a dedicated recursive search instead of the generic walk helper","timestamp":1775664883665,"segment":0}
{"run":16,"commit":"d48202c","metric":8064.977,"metrics":{},"status":"keep","description":"Use synchronous file reads in the sequential scan loop to remove per-file promise overhead","timestamp":1775664941228,"segment":0}
{"run":17,"commit":"d48202c","metric":8209.543,"metrics":{},"status":"discard","description":"Switch recursive discovery from async readdir to synchronous readdirSync","timestamp":1775665003004,"segment":0}
{"run":18,"commit":"8292972","metric":8016.543,"metrics":{},"status":"keep","description":"Avoid await overhead for synchronous provider and rule executions by only awaiting promise-like results","timestamp":1775665063588,"segment":0}
{"run":19,"commit":"f05c769","metric":7893.872,"metrics":{},"status":"keep","description":"Cut hot-loop allocations in provider fact writes and weighted finding collection","timestamp":1775665118283,"segment":0}
{"run":20,"commit":"81fd39b","metric":7847.713,"metrics":{},"status":"keep","description":"Use object-backed fact buckets instead of inner Maps for repo, directory, and file fact lookups","timestamp":1775665209870,"segment":0}
{"run":21,"commit":"81fd39b","metric":7969.133,"metrics":{},"status":"discard","description":"Inline provider and rule execution per context to avoid singleton context-array allocations","timestamp":1775665331858,"segment":0}
{"run":22,"commit":"1cfc4c4","metric":7810.091,"metrics":{},"status":"keep","description":"Stop cloning durable fact sets on every file and trim retained fact buckets in one pass","timestamp":1775665384738,"segment":0}
{"run":23,"commit":"82493ce","metric":7807.31,"metrics":{},"status":"keep","description":"Batch base file fact writes so each file bucket is initialized once per scan iteration","timestamp":1775665455425,"segment":0}
{"run":24,"commit":"82493ce","metric":8260.052,"metrics":{},"status":"discard","description":"Rewrite getExpressionPath as an iterative path builder to avoid recursive array spreads","timestamp":1775665527542,"segment":0}
{"run":25,"commit":"82493ce","metric":7906.021,"metrics":{},"status":"discard","description":"Initialize new file fact buckets with a null-prototype record instead of object spread","timestamp":1775665564579,"segment":0}
{"run":26,"commit":"82493ce","metric":8109.39,"metrics":{},"status":"discard","description":"Rewrite file and directory score aggregation with object-backed accumulators and explicit loops","timestamp":1775665627257,"segment":0}
{"run":27,"commit":"82493ce","metric":7851.369,"metrics":{},"status":"discard","description":"Replace function parameter map/filter and modifier some() calls with manual loops","timestamp":1775665671173,"segment":0}
{"run":28,"commit":"0143c91","metric":7791.422,"metrics":{},"status":"keep","description":"Avoid path join allocations in try/catch boundary-category detection by matching key segment pairs directly","timestamp":1775665740732,"segment":0}
{"run":29,"commit":"0143c91","metric":7814.432,"metrics":{},"status":"discard","description":"Replace comment regex matchAll iteration with a manual exec loop","timestamp":1775665789305,"segment":0}
{"run":30,"commit":"5f489a0","metric":7487.75,"metrics":{},"status":"keep","description":"Build duplicate-function serialization with a shared string-part buffer instead of per-node child strings","timestamp":1775665841096,"segment":0}
{"run":31,"commit":"4219e2a","metric":7442.58,"metrics":{},"status":"keep","description":"Use a shared string-parts buffer for test mock node-shape fingerprinting instead of recursive child-string joins","timestamp":1775665899073,"segment":0}
{"run":32,"commit":"4219e2a","metric":8682.092,"metrics":{},"status":"discard","description":"Stream duplicate-function serialization directly into the SHA-1 hash instead of joining a semantic-shape string first","timestamp":1775665993089,"segment":0}
